{
  "version": "0.1.0",
  "id": "snow_camp_20260607",
  "title": "雪地营地",
  "theme": "snow_camp",
  "map": {
    "width": 64,
    "height": 64,
    "tile_width": 32,
    "tile_height": 32,
    "orientation": "orthogonal"
  },
  "regions": [
    {
      "id": "campfire_01",
      "type": "campfire",
      "position": "center",
      "size": "small",
      "priority": 80
    },
    {
      "id": "cabin_01",
      "type": "cabin",
      "position": "center",
      "size": "small",
      "priority": 75
    }
  ],
  "paths": [
    {
      "from": "spawn_01",
      "to": "campfire_01",
      "kind": "dirt_road"
    },
    {
      "from": "campfire_01",
      "to": "cabin_01",
      "kind": "dirt_road"
    }
  ],
  "objects": [
    {
      "type": "pine",
      "count": 80,
      "placement": "forest_edges"
    },
    {
      "type": "rock",
      "count": 12,
      "placement": "scattered"
    },
    {
      "type": "campfire",
      "count": 1,
      "placement": "near:campfire_01"
    }
  ],
  "entities": [
    {
      "id": "spawn_01",
      "type": "player_spawn",
      "count": 1,
      "position": "bottom_center",
      "placement": null
    },
    {
      "id": null,
      "type": "guard",
      "count": 2,
      "position": null,
      "placement": "near:campfire_01"
    }
  ],
  "constraints": {
    "walkable_spawn": true,
    "connect_key_regions": true,
    "no_blocked_doors": true,
    "objects_require_walkable_neighbor": true
  },
  "seed": 20260607,
  "tileset_id": "default_rpg_32"
}
